{
  "schemaVersion": "1.0.0",
  "siteId": "greenhouse-01",
  "zones": [
    {"zoneId":"greenhouse-01","displayName":"Greenhouse 01","kind":"site","usdPrimPath":"/World/Environment/Greenhouse"},
    {"zoneId":"interior","displayName":"Greenhouse Interior","kind":"interior","parentZoneId":"greenhouse-01","usdPrimPath":"/World/Environment/Greenhouse"},
    {"zoneId":"exterior","displayName":"Greenhouse Exterior","kind":"exterior","parentZoneId":"greenhouse-01","usdPrimPath":"/World/Environment/Exterior"},
    {"zoneId":"air-zone-01","displayName":"Interior Air Zone 1","kind":"air","parentZoneId":"interior","usdPrimPath":"/World/Sensors/AirZones/AirZone_01"},
    {"zoneId":"air-zone-02","displayName":"Interior Air Zone 2","kind":"air","parentZoneId":"interior","usdPrimPath":"/World/Sensors/AirZones/AirZone_02"},
    {"zoneId":"air-zone-03","displayName":"Interior Air Zone 3","kind":"air","parentZoneId":"interior","usdPrimPath":"/World/Sensors/AirZones/AirZone_03"},
    {"zoneId":"air-zone-04","displayName":"Interior Air Zone 4","kind":"air","parentZoneId":"interior","usdPrimPath":"/World/Sensors/AirZones/AirZone_04"},
    {"zoneId":"air-zone-05","displayName":"Interior Air Zone 5","kind":"air","parentZoneId":"interior","usdPrimPath":"/World/Sensors/AirZones/AirZone_05"},
    {"zoneId":"bed-01","displayName":"Growing Bed 1","kind":"bed","parentZoneId":"interior","usdPrimPath":"/World/Environment/Greenhouse/GrowingAreas/Bed_01"},
    {"zoneId":"bed-02","displayName":"Growing Bed 2","kind":"bed","parentZoneId":"interior","usdPrimPath":"/World/Environment/Greenhouse/GrowingAreas/Bed_02"},
    {"zoneId":"bed-03","displayName":"Growing Bed 3","kind":"bed","parentZoneId":"interior","usdPrimPath":"/World/Environment/Greenhouse/GrowingAreas/Bed_03"},
    {"zoneId":"bed-04","displayName":"Growing Bed 4","kind":"bed","parentZoneId":"interior","usdPrimPath":"/World/Environment/Greenhouse/GrowingAreas/Bed_04"},
    {"zoneId":"bed-05","displayName":"Growing Bed 5","kind":"bed","parentZoneId":"interior","usdPrimPath":"/World/Environment/Greenhouse/GrowingAreas/Bed_05"},
    {"zoneId":"bed-06","displayName":"Growing Bed 6","kind":"bed","parentZoneId":"interior","usdPrimPath":"/World/Environment/Greenhouse/GrowingAreas/Bed_06"},
    {"zoneId":"bed-07","displayName":"Growing Bed 7","kind":"bed","parentZoneId":"interior","usdPrimPath":"/World/Environment/Greenhouse/GrowingAreas/Bed_07"},
    {"zoneId":"bed-08","displayName":"Growing Bed 8","kind":"bed","parentZoneId":"interior","usdPrimPath":"/World/Environment/Greenhouse/GrowingAreas/Bed_08"},
    {"zoneId":"ventilation","displayName":"Ventilation System","kind":"service","parentZoneId":"greenhouse-01","usdPrimPath":"/World/Environment/Greenhouse/Ventilation"},
    {"zoneId":"irrigation","displayName":"Irrigation System","kind":"service","parentZoneId":"greenhouse-01","usdPrimPath":"/World/Environment/Greenhouse/Irrigation"},
    {"zoneId":"access","displayName":"Access System","kind":"service","parentZoneId":"greenhouse-01","usdPrimPath":"/World/Environment/Greenhouse/Doors"}
  ],
  "devices": [
    {"deviceId":"air-station-01","displayName":"Air Station 1","deviceType":"air-station","zoneId":"air-zone-01","source":"simulated","usdPrimPath":"/World/Sensors/AirStations/AirStation_01","capabilities":[{"name":"air-temperature-c","valueType":"number","unit":"Cel","minimum":-20,"maximum":60},{"name":"relative-humidity-pct","valueType":"number","unit":"%","minimum":0,"maximum":100}]},
    {"deviceId":"air-station-02","displayName":"Air Station 2","deviceType":"air-station","zoneId":"air-zone-02","source":"simulated","usdPrimPath":"/World/Sensors/AirStations/AirStation_02","capabilities":[{"name":"air-temperature-c","valueType":"number","unit":"Cel","minimum":-20,"maximum":60},{"name":"relative-humidity-pct","valueType":"number","unit":"%","minimum":0,"maximum":100}]},
    {"deviceId":"air-station-03","displayName":"Air Station 3","deviceType":"air-station","zoneId":"air-zone-03","source":"simulated","usdPrimPath":"/World/Sensors/AirStations/AirStation_03","capabilities":[{"name":"air-temperature-c","valueType":"number","unit":"Cel","minimum":-20,"maximum":60},{"name":"relative-humidity-pct","valueType":"number","unit":"%","minimum":0,"maximum":100}]},
    {"deviceId":"air-station-04","displayName":"Air Station 4","deviceType":"air-station","zoneId":"air-zone-04","source":"simulated","usdPrimPath":"/World/Sensors/AirStations/AirStation_04","capabilities":[{"name":"air-temperature-c","valueType":"number","unit":"Cel","minimum":-20,"maximum":60},{"name":"relative-humidity-pct","valueType":"number","unit":"%","minimum":0,"maximum":100}]},
    {"deviceId":"air-station-05","displayName":"Air Station 5","deviceType":"air-station","zoneId":"air-zone-05","source":"simulated","usdPrimPath":"/World/Sensors/AirStations/AirStation_05","capabilities":[{"name":"air-temperature-c","valueType":"number","unit":"Cel","minimum":-20,"maximum":60},{"name":"relative-humidity-pct","valueType":"number","unit":"%","minimum":0,"maximum":100}]},
    {"deviceId":"soil-station-bed-01","displayName":"Bed 1 Soil Station","deviceType":"soil-station","zoneId":"bed-01","source":"simulated","usdPrimPath":"/World/Sensors/SoilStations/Bed_01","capabilities":[{"name":"soil-temperature-c","valueType":"number","unit":"Cel","minimum":-10,"maximum":50},{"name":"soil-water-content-ratio","valueType":"number","unit":"1","minimum":0,"maximum":1}]},
    {"deviceId":"soil-station-bed-02","displayName":"Bed 2 Soil Station","deviceType":"soil-station","zoneId":"bed-02","source":"simulated","usdPrimPath":"/World/Sensors/SoilStations/Bed_02","capabilities":[{"name":"soil-temperature-c","valueType":"number","unit":"Cel","minimum":-10,"maximum":50},{"name":"soil-water-content-ratio","valueType":"number","unit":"1","minimum":0,"maximum":1}]},
    {"deviceId":"soil-station-bed-03","displayName":"Bed 3 Soil Station","deviceType":"soil-station","zoneId":"bed-03","source":"simulated","usdPrimPath":"/World/Sensors/SoilStations/Bed_03","capabilities":[{"name":"soil-temperature-c","valueType":"number","unit":"Cel","minimum":-10,"maximum":50},{"name":"soil-water-content-ratio","valueType":"number","unit":"1","minimum":0,"maximum":1}]},
    {"deviceId":"soil-station-bed-04","displayName":"Bed 4 Soil Station","deviceType":"soil-station","zoneId":"bed-04","source":"simulated","usdPrimPath":"/World/Sensors/SoilStations/Bed_04","capabilities":[{"name":"soil-temperature-c","valueType":"number","unit":"Cel","minimum":-10,"maximum":50},{"name":"soil-water-content-ratio","valueType":"number","unit":"1","minimum":0,"maximum":1}]},
    {"deviceId":"soil-station-bed-05","displayName":"Bed 5 Soil Station","deviceType":"soil-station","zoneId":"bed-05","source":"simulated","usdPrimPath":"/World/Sensors/SoilStations/Bed_05","capabilities":[{"name":"soil-temperature-c","valueType":"number","unit":"Cel","minimum":-10,"maximum":50},{"name":"soil-water-content-ratio","valueType":"number","unit":"1","minimum":0,"maximum":1}]},
    {"deviceId":"fan-01","displayName":"Extraction Fan 1","deviceType":"fan","zoneId":"ventilation","source":"simulated","usdPrimPath":"/World/Environment/Greenhouse/Ventilation/Fan_01","capabilities":[{"name":"speed-ratio","valueType":"number","unit":"1","minimum":0,"maximum":1,"writable":true},{"name":"running","valueType":"boolean"}]},
    {"deviceId":"fan-02","displayName":"Extraction Fan 2","deviceType":"fan","zoneId":"ventilation","source":"simulated","usdPrimPath":"/World/Environment/Greenhouse/Ventilation/Fan_02","capabilities":[{"name":"speed-ratio","valueType":"number","unit":"1","minimum":0,"maximum":1,"writable":true},{"name":"running","valueType":"boolean"}]},
    {"deviceId":"fan-03","displayName":"Extraction Fan 3","deviceType":"fan","zoneId":"ventilation","source":"simulated","usdPrimPath":"/World/Environment/Greenhouse/Ventilation/Fan_03","capabilities":[{"name":"speed-ratio","valueType":"number","unit":"1","minimum":0,"maximum":1,"writable":true},{"name":"running","valueType":"boolean"}]},
    {"deviceId":"window-left","displayName":"Left Side Curtain","deviceType":"window","zoneId":"ventilation","source":"simulated","usdPrimPath":"/World/Environment/Greenhouse/Ventilation/GH_Side_Curtain_L","capabilities":[{"name":"position-ratio","valueType":"number","unit":"1","minimum":0,"maximum":1,"writable":true}]},
    {"deviceId":"window-right","displayName":"Right Side Curtain","deviceType":"window","zoneId":"ventilation","source":"simulated","usdPrimPath":"/World/Environment/Greenhouse/Ventilation/GH_Side_Curtain_R","capabilities":[{"name":"position-ratio","valueType":"number","unit":"1","minimum":0,"maximum":1,"writable":true}]},
    {"deviceId":"irrigation-valve-bed-01","displayName":"Bed 1 Irrigation Valve","deviceType":"irrigation-valve","zoneId":"bed-01","source":"simulated","usdPrimPath":"/World/Environment/Greenhouse/Irrigation/Valve_Bed_01","capabilities":[{"name":"open-ratio","valueType":"number","unit":"1","minimum":0,"maximum":1,"writable":true}]},
    {"deviceId":"irrigation-valve-bed-02","displayName":"Bed 2 Irrigation Valve","deviceType":"irrigation-valve","zoneId":"bed-02","source":"simulated","usdPrimPath":"/World/Environment/Greenhouse/Irrigation/Valve_Bed_02","capabilities":[{"name":"open-ratio","valueType":"number","unit":"1","minimum":0,"maximum":1,"writable":true}]},
    {"deviceId":"irrigation-valve-bed-03","displayName":"Bed 3 Irrigation Valve","deviceType":"irrigation-valve","zoneId":"bed-03","source":"simulated","usdPrimPath":"/World/Environment/Greenhouse/Irrigation/Valve_Bed_03","capabilities":[{"name":"open-ratio","valueType":"number","unit":"1","minimum":0,"maximum":1,"writable":true}]},